{
  "schema": "organization_window_source_coverage.v1",
  "season": 20262027,
  "as_of": "2026-07-28",
  "package_fingerprint": "b9d5666a10cd1fab691191d56c4713f261e59e8b29f500735e3296f94de16389",
  "board_fingerprint": "30083b67d6ac6a8bd185cc8a21f074c6cc00301e415cd60b954dcf68ff79a920",
  "expected_organizations": 32,
  "profiles": [
    {
      "profile_key": "deployment.penalty_kill_depth",
      "method_version": "lineup_penalty_kill_depth.v1",
      "required": true,
      "organizations_with_observation": 32,
      "organizations_with_value": 32,
      "missing_organizations": [],
      "complete": true
    },
    {
      "profile_key": "deployment.power_play_depth",
      "method_version": "lineup_power_play_depth.v1",
      "required": true,
      "organizations_with_observation": 32,
      "organizations_with_value": 32,
      "missing_organizations": [],
      "complete": true
    },
    {
      "profile_key": "development.organization_depth",
      "method_version": "organization_lineup_depth.v1",
      "required": true,
      "organizations_with_observation": 0,
      "organizations_with_value": 0,
      "missing_organizations": [
        "ANA",
        "BOS",
        "BUF",
        "CAR",
        "CBJ",
        "CGY",
        "CHI",
        "COL",
        "DAL",
        "DET",
        "EDM",
        "FLA",
        "LAK",
        "MIN",
        "MTL",
        "NJD",
        "NSH",
        "NYI",
        "NYR",
        "OTT",
        "PHI",
        "PIT",
        "SEA",
        "SJS",
        "STL",
        "TBL",
        "TOR",
        "UTA",
        "VAN",
        "VGK",
        "WPG",
        "WSH"
      ],
      "complete": false
    },
    {
      "profile_key": "development.prospect_conversion",
      "method_version": "prospect_conversion_efficiency.v1",
      "required": false,
      "organizations_with_observation": 0,
      "organizations_with_value": 0,
      "missing_organizations": [
        "ANA",
        "BOS",
        "BUF",
        "CAR",
        "CBJ",
        "CGY",
        "CHI",
        "COL",
        "DAL",
        "DET",
        "EDM",
        "FLA",
        "LAK",
        "MIN",
        "MTL",
        "NJD",
        "NSH",
        "NYI",
        "NYR",
        "OTT",
        "PHI",
        "PIT",
        "SEA",
        "SJS",
        "STL",
        "TBL",
        "TOR",
        "UTA",
        "VAN",
        "VGK",
        "WPG",
        "WSH"
      ],
      "complete": false
    },
    {
      "profile_key": "development.recall_depth",
      "method_version": "organization_recall_depth.v1",
      "required": true,
      "organizations_with_observation": 0,
      "organizations_with_value": 0,
      "missing_organizations": [
        "ANA",
        "BOS",
        "BUF",
        "CAR",
        "CBJ",
        "CGY",
        "CHI",
        "COL",
        "DAL",
        "DET",
        "EDM",
        "FLA",
        "LAK",
        "MIN",
        "MTL",
        "NJD",
        "NSH",
        "NYI",
        "NYR",
        "OTT",
        "PHI",
        "PIT",
        "SEA",
        "SJS",
        "STL",
        "TBL",
        "TOR",
        "UTA",
        "VAN",
        "VGK",
        "WPG",
        "WSH"
      ],
      "complete": false
    },
    {
      "profile_key": "nhl.defense_depth",
      "method_version": "lineup_defense_depth.v1",
      "required": true,
      "organizations_with_observation": 32,
      "organizations_with_value": 32,
      "missing_organizations": [],
      "complete": true
    },
    {
      "profile_key": "nhl.expected_points",
      "method_version": "icecast_expected_points.v1",
      "required": true,
      "organizations_with_observation": 32,
      "organizations_with_value": 32,
      "missing_organizations": [],
      "complete": true
    },
    {
      "profile_key": "nhl.forward_depth",
      "method_version": "lineup_forward_depth.v1",
      "required": true,
      "organizations_with_observation": 32,
      "organizations_with_value": 32,
      "missing_organizations": [],
      "complete": true
    },
    {
      "profile_key": "nhl.goalie_quality",
      "method_version": "lineup_goalie_quality.v1",
      "required": true,
      "organizations_with_observation": 32,
      "organizations_with_value": 32,
      "missing_organizations": [],
      "complete": true
    },
    {
      "profile_key": "nhl.team_strength",
      "method_version": "icecast_team_strength.v1",
      "required": true,
      "organizations_with_observation": 32,
      "organizations_with_value": 32,
      "missing_organizations": [],
      "complete": true
    },
    {
      "profile_key": "pipeline.prospect_development",
      "method_version": "prospect_development_score.v1",
      "required": true,
      "organizations_with_observation": 32,
      "organizations_with_value": 32,
      "missing_organizations": [],
      "complete": true
    },
    {
      "profile_key": "pipeline.prospect_pool",
      "method_version": "prospect_pool_score.v1",
      "required": true,
      "organizations_with_observation": 32,
      "organizations_with_value": 32,
      "missing_organizations": [],
      "complete": true
    },
    {
      "profile_key": "pipeline.prospect_readiness",
      "method_version": "prospect_readiness_score.v1",
      "required": true,
      "organizations_with_observation": 32,
      "organizations_with_value": 32,
      "missing_organizations": [],
      "complete": true
    },
    {
      "profile_key": "pipeline.training_camp_arrival",
      "method_version": "training_camp_arrival.v1",
      "required": true,
      "organizations_with_observation": 32,
      "organizations_with_value": 32,
      "missing_organizations": [],
      "complete": true
    },
    {
      "profile_key": "resilience.goalie_dependency",
      "method_version": "lineup_goalie_dependency.v1",
      "required": true,
      "organizations_with_observation": 32,
      "organizations_with_value": 32,
      "missing_organizations": [],
      "complete": true
    },
    {
      "profile_key": "resilience.roster_concentration",
      "method_version": "lineup_value_concentration.v1",
      "required": true,
      "organizations_with_observation": 32,
      "organizations_with_value": 32,
      "missing_organizations": [],
      "complete": true
    },
    {
      "profile_key": "resilience.schedule_fatigue",
      "method_version": "schedule_fatigue_exposure.v1",
      "required": true,
      "organizations_with_observation": 32,
      "organizations_with_value": 32,
      "missing_organizations": [],
      "complete": true
    }
  ],
  "complete_required_profiles": 14,
  "required_profiles": 16,
  "rank_eligible_organizations": 0,
  "production_ranked": false,
  "disclosures": [
    "Cohort presence is not profile completeness; each adapter-ready profile is audited independently across the canonical league.",
    "Production-ranked means every organization passed the balanced.v1 rank gate; it is not a calibration or predictive claim."
  ]
}
